{
  "name": "Two-Weapon Fighting",
  "category": "Fighting Style",
  "prerequisite": {
    "features": ["Fighting Style Feature"]
  },
  "benefits": [
    {
      "name": "Off-Hand Damage Modifier",
      "description": "When you make an extra attack as a result of using a weapon that has the Light property, you can add your ability modifier to the damage of that attack if you aren't already adding it to the damage.",
      "type": "combat"
    }
  ],
  "repeatable": false,
  "sourceBook": "Player's Handbook 2024"
}